{
  "chainId": 84532,
  "chainName": "Base Sepolia Testnet",
  "deployedAt": "2026-05-19T20:29:27Z",
  "deployer": "0xD1c4f07c277Bcc155693E3a569A9587E9237bA07",
  "owner": "0xb0217656A8160fa6D601c95844a73173237DEcFE",
  "contracts": {"ExecutionProxy":{"address":"0x1868f62A7001de25947741a886720EacF62655AB","salt":"0xe5695b3064e7fc6a22129e383dc584c25654a8213cec45c672e2044f856bdfd7","verified":false,"txHash":"0x3e4fcc111d57e94d5a34cc248e90c6ba3065f2dfff9f931b6cf4cea8edc62cfa","blockNumber":41727140},"Router":{"address":"0xED79938d83089D610C3d38DAe52B771A11614B41","salt":"0xcf23702408e9d272c8da1a9a59547690dfcecf0c8c6e6067014598d60ccd5a42","verified":false,"txHash":"0x99f03e9f44bdd3da226f1d8dabdcf5d86de66c3d358bdc2d13345dbca1057ed4","blockNumber":40852937},"Tupler":{"address":"0x1AbbF67fBf2b8Fbc04B833A3Db4526FFda55b8e2","salt":"0x44c13c2358951792cfdc0d558a58e0a0500a8c5a5d2902ffbf2c36047b727a3b","verified":false,"txHash":"0x99f03e9f44bdd3da226f1d8dabdcf5d86de66c3d358bdc2d13345dbca1057ed4","blockNumber":40852937},"Integer":{"address":"0x2CB4EEB698b771048405a046fd7fBC34133F2C40","salt":"0x9f6b8bccec85325cbb3705e9cceab8e9c2d0952878cb98893a8abd02471a1f04","verified":false,"txHash":"0x99f03e9f44bdd3da226f1d8dabdcf5d86de66c3d358bdc2d13345dbca1057ed4","blockNumber":40852937},"Bytes32":{"address":"0x6F87EdC08983E4FD3810953bA5a2d56DCe9775c3","salt":"0xf04e6af6d5fc0a511d651246d2ada742f1b6f46573186046393880ac2d7a0836","verified":false,"txHash":"0x99f03e9f44bdd3da226f1d8dabdcf5d86de66c3d358bdc2d13345dbca1057ed4","blockNumber":40852937},"BlockchainInfo":{"address":"0x2F4abb94d70F94bC44d90A806Be4AC8640000869","salt":"0xaf54df03108daf7917c135b4db85ef912acf4e15ec2666d9e4793464ea9f4d0a","verified":false,"txHash":"0x99f03e9f44bdd3da226f1d8dabdcf5d86de66c3d358bdc2d13345dbca1057ed4","blockNumber":40852937},"ArraysConverter":{"address":"0x0Ba8D8de6412232FE41AAcb98d4e1FCcfbF0b47f","salt":"0x110727a197cc76e5abd1eab0d6173fe2ffec4dbb21c580b8ec4c1b0a5dcf9a35","verified":false,"txHash":"0x99f03e9f44bdd3da226f1d8dabdcf5d86de66c3d358bdc2d13345dbca1057ed4","blockNumber":40852937}},
  "create3Factory": "0x9fBB3DF7C40Da2e5A0dE984fFE2CCB7C47cd0ABf"
}
