{
  "chainId": 1,
  "chainName": "Ethereum Mainnet",
  "deployedAt": "2026-05-12T18:31:13Z",
  "deployer": "0xD1c4f07c277Bcc155693E3a569A9587E9237bA07",
  "owner": "0xb0217656A8160fa6D601c95844a73173237DEcFE",
  "contracts": {"ExecutionProxy":{"address":"0xEd06BFe3F04B09f90996850129c5312A335dfbDe","salt":"0xf1848e9c3c16dc8fd70e24b08f654501023397030d5628d8f04e88f2cf6f7206","verified":false,"txHash":"0x9fa9c6f17d4b7efbbc500eea232c57bbe602a0cb288ebccde7eb6ffbcfce2d89","blockNumber":25080843},"Router":{"address":"0xED79938d83089D610C3d38DAe52B771A11614B41","salt":"0xcf23702408e9d272c8da1a9a59547690dfcecf0c8c6e6067014598d60ccd5a42","verified":false,"txHash":"0x43b341390102e0a463e2d71f5cf64838268a70eecee7fc954a3bac152e79dd12","blockNumber":25024627},"Tupler":{"address":"0x1AbbF67fBf2b8Fbc04B833A3Db4526FFda55b8e2","salt":"0x44c13c2358951792cfdc0d558a58e0a0500a8c5a5d2902ffbf2c36047b727a3b","verified":false,"txHash":"0x43b341390102e0a463e2d71f5cf64838268a70eecee7fc954a3bac152e79dd12","blockNumber":25024627},"Integer":{"address":"0x2CB4EEB698b771048405a046fd7fBC34133F2C40","salt":"0x9f6b8bccec85325cbb3705e9cceab8e9c2d0952878cb98893a8abd02471a1f04","verified":false,"txHash":"0x43b341390102e0a463e2d71f5cf64838268a70eecee7fc954a3bac152e79dd12","blockNumber":25024627},"Bytes32":{"address":"0x6F87EdC08983E4FD3810953bA5a2d56DCe9775c3","salt":"0xf04e6af6d5fc0a511d651246d2ada742f1b6f46573186046393880ac2d7a0836","verified":false,"txHash":"0x43b341390102e0a463e2d71f5cf64838268a70eecee7fc954a3bac152e79dd12","blockNumber":25024627},"BlockchainInfo":{"address":"0x2F4abb94d70F94bC44d90A806Be4AC8640000869","salt":"0xaf54df03108daf7917c135b4db85ef912acf4e15ec2666d9e4793464ea9f4d0a","verified":false,"txHash":"0x43b341390102e0a463e2d71f5cf64838268a70eecee7fc954a3bac152e79dd12","blockNumber":25024627},"ArraysConverter":{"address":"0x0Ba8D8de6412232FE41AAcb98d4e1FCcfbF0b47f","salt":"0x110727a197cc76e5abd1eab0d6173fe2ffec4dbb21c580b8ec4c1b0a5dcf9a35","verified":false,"txHash":"0x43b341390102e0a463e2d71f5cf64838268a70eecee7fc954a3bac152e79dd12","blockNumber":25024627}},
  "create3Factory": "0x9fBB3DF7C40Da2e5A0dE984fFE2CCB7C47cd0ABf"
}
